{
  "kind": "desen.source",
  "desen": "0.1.0",
  "id": "com.example.account-app",
  "catalogs": [
    {
      "id": "com.example.web-catalog",
      "version": "1.0.0",
      "target": "web-react"
    }
  ],
  "entry": "sign-in",
  "surfaces": {
    "sign-in": {
      "id": "sign-in",
      "state": {
        "email": {
          "schema": {
            "type": "string"
          },
          "initial": ""
        },
        "password": {
          "schema": {
            "type": "string"
          },
          "initial": ""
        }
      },
      "resources": {},
      "root": {
        "id": "sign-in.layout",
        "use": "com.example.ui/Stack",
        "props": {
          "direction": "vertical",
          "gap": "md",
          "maxWidth": 420
        },
        "slots": {
          "default": [
            {
              "id": "sign-in.title",
              "use": "com.example.ui/Text",
              "props": {
                "text": "Sign in",
                "role": "heading"
              }
            },
            {
              "id": "sign-in.email",
              "use": "com.example.ui/TextField",
              "props": {
                "label": "Email",
                "value": {
                  "$ref": "state.email"
                }
              },
              "on": {
                "change": [
                  {
                    "type": "state.set",
                    "path": "email",
                    "value": {
                      "$ref": "event.value"
                    }
                  }
                ]
              }
            },
            {
              "id": "sign-in.password",
              "use": "com.example.ui/TextField",
              "props": {
                "label": "Password",
                "secure": true,
                "value": {
                  "$ref": "state.password"
                }
              },
              "on": {
                "change": [
                  {
                    "type": "state.set",
                    "path": "password",
                    "value": {
                      "$ref": "event.value"
                    }
                  }
                ]
              }
            },
            {
              "id": "sign-in.error",
              "use": "com.example.ui/Alert",
              "when": {
                "op": "eq",
                "args": [
                  {
                    "$ref": "operation.signIn.status"
                  },
                  "failed"
                ]
              },
              "props": {
                "tone": "critical",
                "text": "Sign-in failed. Check your details and try again."
              }
            },
            {
              "id": "sign-in.submit",
              "use": "com.example.ui/Button",
              "props": {
                "label": "Sign in",
                "variant": "primary",
                "loading": {
                  "$ref": "operation.signIn.pending",
                  "fallback": false
                }
              },
              "on": {
                "press": [
                  {
                    "type": "operation.invoke",
                    "operation": "com.example.auth/signIn",
                    "as": "signIn",
                    "input": {
                      "email": {
                        "$ref": "state.email"
                      },
                      "password": {
                        "$ref": "state.password"
                      }
                    },
                    "concurrency": "replace",
                    "onSuccess": [
                      {
                        "type": "navigate",
                        "surface": "home"
                      }
                    ]
                  }
                ]
              }
            }
          ]
        }
      }
    },
    "home": {
      "id": "home",
      "state": {},
      "resources": {},
      "root": {
        "id": "home.layout",
        "use": "com.example.ui/Stack",
        "props": {
          "direction": "vertical",
          "gap": "md"
        },
        "slots": {
          "default": [
            {
              "id": "home.title",
              "use": "com.example.ui/Text",
              "props": {
                "text": "Welcome",
                "role": "heading"
              }
            }
          ]
        }
      }
    }
  },
  "authoring": {
    "canvas": {
      "sign-in": {
        "x": 0,
        "y": 0,
        "width": 420,
        "height": 720
      },
      "home": {
        "x": 520,
        "y": 0,
        "width": 420,
        "height": 720
      }
    }
  },
  "extensions": {}
}